{
  "broker": {
    "certs": {
      "ca_crt": "/home/yoch/mqtt-python-client-bench/certs/ca.crt",
      "fingerprint": "sha256 Fingerprint=42:DA:72:5E:7F:59:64:A5:3F:6C:BC:FC:64:AB:C6:01:BF:A0:1C:57:67:71:AF:5C:83:97:DA:17:F3:FA:13:9B",
      "server_crt": "/home/yoch/mqtt-python-client-bench/certs/server.crt",
      "server_key": "/home/yoch/mqtt-python-client-bench/certs/server.key"
    },
    "config_hash": "29f25cf4f6957571e9767f5d30c775a27be0a7e481d7cfc0a743850fd5827814",
    "container_name": "mqtt-python-client-bench-mosquitto-1",
    "cpuset": "1,5",
    "cpuset_observed": "1,5",
    "host": "127.0.0.1",
    "image": "eclipse-mosquitto:2.0.20@sha256:21421af7b32bf9ce508e9090c8eb13bb81f410ca778dc205506180a6f862d0eb",
    "image_digest": "eclipse-mosquitto@sha256:21421af7b32bf9ce508e9090c8eb13bb81f410ca778dc205506180a6f862d0eb",
    "managed_broker": true,
    "port": 11883,
    "tls_port": 11884
  },
  "client": "gmqtt",
  "client_identity": {
    "adapter": "gmqtt",
    "client": "gmqtt",
    "client_module": "/home/yoch/mqtt-python-client-bench/.venv/lib/python3.12/site-packages/gmqtt/__init__.py",
    "client_version": "0.7.0",
    "implementation_language": "python",
    "io_model": "asyncio_bridged",
    "stability": "stable",
    "synthetic_mids": true
  },
  "client_path": null,
  "cpusets": {
    "broker": "1,5",
    "loadgen": "2,6",
    "orch": "3,7",
    "sut": "0,4"
  },
  "environment": {
    "client_versions": {
      "aiomqtt": "2.5.1",
      "aiomqtt3": null,
      "amqtt": "0.11.3",
      "awscrt": "0.35.0",
      "gmqtt": "0.7.0",
      "paho": "2.1.0",
      "zmqtt": "0.0.5"
    },
    "cpu_count": 8,
    "cpu_model": "Intel(R) Core(TM) i7-3770 CPU @ 3.40GHz",
    "hostname": "yoch-HP",
    "loadavg": [
      4.0478515625,
      3.42919921875,
      2.64453125
    ],
    "machine": "x86_64",
    "physical_cpu_groups": [
      [
        0,
        4
      ],
      [
        1,
        5
      ],
      [
        2,
        6
      ],
      [
        3,
        7
      ]
    ],
    "platform": "Linux-6.8.0-134-lowlatency-x86_64-with-glibc2.39",
    "python": "3.12.3",
    "scaling_governor": "schedutil"
  },
  "profile": "smoke",
  "results": [
    {
      "point": {
        "cadence": "capacity",
        "description": "Client ceiling probe: growing emqtt-bench offer vs one SUT subscriber. Same offer grid as broker_ceiling_ingress; compare delivered vs effective_offer + $SYS.",
        "drain_s": 2.0,
        "duration_s": 3.0,
        "inflight": 20,
        "ingress_target_msgs_per_s": 64000,
        "loadgen_clients": 64,
        "max_queued": 200,
        "name": "client_ceiling_ingress",
        "network": "localhost",
        "non_comparable": true,
        "outstanding": 64,
        "payload": "telemetry256",
        "protocol": "MQTTv311",
        "publishers": 1,
        "qos_publish": 0,
        "qos_subscribe": 0,
        "scenario": "client_ceiling_ingress",
        "subscribers": 1,
        "subscription": "exact",
        "suite": "full",
        "tags": [
          "diagnostic"
        ],
        "tls": false,
        "topic_topology": "single",
        "topology": "subscriber_ingress",
        "warmup_s": 1.0
      },
      "runs": [
        {
          "bottleneck": "loadgen_limited",
          "client": "gmqtt",
          "client_path": null,
          "cpusets": {
            "broker": "1,5",
            "loadgen": "2,6",
            "orch": "3,7",
            "sut": "0,4"
          },
          "delivery_offer_ratio": 0.3894178479021274,
          "effective_offer_msgs_per_s": 64000.0,
          "environment": {
            "client_versions": {
              "aiomqtt": "2.5.1",
              "aiomqtt3": null,
              "amqtt": "0.11.3",
              "awscrt": "0.35.0",
              "gmqtt": "0.7.0",
              "paho": "2.1.0",
              "zmqtt": "0.0.5"
            },
            "cpu_count": 8,
            "cpu_model": "Intel(R) Core(TM) i7-3770 CPU @ 3.40GHz",
            "hostname": "yoch-HP",
            "loadavg": [
              3.626953125,
              3.275390625,
              2.5615234375
            ],
            "machine": "x86_64",
            "physical_cpu_groups": [
              [
                0,
                4
              ],
              [
                1,
                5
              ],
              [
                2,
                6
              ],
              [
                3,
                7
              ]
            ],
            "platform": "Linux-6.8.0-134-lowlatency-x86_64-with-glibc2.39",
            "python": "3.12.3",
            "scaling_governor": "schedutil"
          },
          "loadgen": {
            "args": [
              "pub",
              "-h",
              "127.0.0.1",
              "-p",
              "11883",
              "-V",
              "5",
              "-c",
              "64",
              "-i",
              "10",
              "-I",
              "1",
              "-t",
              "bench/f1fce5f3/org/acme/site/s0000/device/d0000/telemetry/temperature",
              "-s",
              "256",
              "-q",
              "0",
              "-F",
              "100"
            ],
            "clients": 64,
            "effective_offer_msgs_per_s": 64000.0,
            "image": "emqx/emqtt-bench:latest@sha256:ae7f2d56cd49b14824c835140c808b093c5e3f2defb3a29b34b17560feb456cd",
            "image_digest": "emqx/emqtt-bench@sha256:ae7f2d56cd49b14824c835140c808b093c5e3f2defb3a29b34b17560feb456cd",
            "interval_ms": 1,
            "mode": "pub",
            "mqtt_version": 5,
            "mqtt_version_override": "emqtt_bench_v311_client_id_rejected_by_mosquitto",
            "mqtt_version_requested": 4,
            "nominal_rate": 64000.0,
            "observed_pub_rate": 31455.0,
            "observed_recv_rate": null,
            "parsed": {
              "kinds": [
                "pub",
                "pub",
                "pub",
                "pub",
                "pub",
                "pub"
              ],
              "last_rate": 61338.66,
              "last_total": 365668,
              "max_rate": 62994.0,
              "median_rate": 62910.0,
              "rates": [
                52404.38,
                62994.0,
                62778.0,
                62910.0,
                62972.0,
                61338.66
              ],
              "samples": 6,
              "totals": [
                52614,
                115608,
                178386,
                241296,
                304268,
                365668
              ]
            },
            "parsed_pub_rate_raw": 62910.0,
            "qos": 0,
            "qos0_pub_counter_double_count": true,
            "stdout_tail": "2s pub_overrun total=52483 rate=31501.50/sec\n\n3s pub total=178386 rate=62778.00/sec\n\n3s pub_overrun total=83876 rate=31393.00/sec\n\n4s pub total=241296 rate=62910.00/sec\n\n4s pub_overrun total=115330 rate=31454.00/sec\n\n5s pub total=304268 rate=62972.00/sec\n\n5s pub_overrun total=146725 rate=31489.47/sec\n=INFO REPORT==== 13-Jul-2026::15:04:34.016427 ===\nSIGTERM received - shutting down\n\n\n6s pub total=365668 rate=61338.66/sec\n\n6s pub_overrun total=177467 rate=30650.05/sec",
            "target_requested": 64000.0
          },
          "loadgen_ref_sub": null,
          "managed_broker": true,
          "network": {
            "applied": false,
            "profile": "localhost",
            "reason": "localhost_noop"
          },
          "non_comparable": true,
          "point": {
            "cadence": "capacity",
            "description": "Client ceiling probe: growing emqtt-bench offer vs one SUT subscriber. Same offer grid as broker_ceiling_ingress; compare delivered vs effective_offer + $SYS.",
            "drain_s": 2.0,
            "duration_s": 3.0,
            "inflight": 20,
            "ingress_target_msgs_per_s": 64000.0,
            "loadgen_clients": 64,
            "max_queued": 200,
            "name": "client_ceiling_ingress",
            "network": "localhost",
            "non_comparable": true,
            "outstanding": 64,
            "payload": "telemetry256",
            "protocol": "MQTTv311",
            "publishers": 1,
            "qos_publish": 0,
            "qos_subscribe": 0,
            "run_id": "f1fce5f3",
            "scenario": "client_ceiling_ingress",
            "subscribers": 1,
            "subscription": "exact",
            "suite": "full",
            "tags": [
              "diagnostic"
            ],
            "tls": false,
            "topic_topology": "single",
            "topology": "subscriber_ingress",
            "warmup_s": 1.0
          },
          "primary_msgs_per_s": 24922.742265736153,
          "protocol_effective": "MQTTv311",
          "qdisc": null,
          "reasons": [
            "loadgen_below_half_nominal",
            "delivery_below_half_offer"
          ],
          "run_id": "f1fce5f3",
          "run_index": 0,
          "schema_version": 1,
          "secondary_msgs_per_s": {
            "subscriber": 24922.742265736153
          },
          "status": "inconclusive",
          "sys_counters": {
            "after": {
              "dropped": 29466,
              "messages_received": 6299306,
              "messages_sent": 5020752,
              "publish_received": 6286797,
              "publish_sent": 4955022,
              "raw": {
                "$SYS/broker/messages/received": 6299306,
                "$SYS/broker/messages/sent": 5020752,
                "$SYS/broker/publish/messages/dropped": 29466,
                "$SYS/broker/publish/messages/received": 6286797,
                "$SYS/broker/publish/messages/sent": 4955022
              }
            },
            "before": {
              "dropped": 29466,
              "messages_received": 6187978,
              "messages_sent": 4909414,
              "publish_received": 6175533,